{
  "schema_id": "IntegrationReceipt", "schema_version": "1.0.0",
  "object_id": "integration-s09-replay-capacity-20260718", "issued_at": "2026-07-18T15:37:57Z",
  "issuer": {"id": "agent-0", "authority_class": "integration-authority"},
  "contour": "governance", "classification": "D1_INTERNAL_SANITIZED",
  "payload": {
    "stage_id": "s09-replay-capacity", "agent_id": "agent-1",
    "ownership_lease_ref": "stages/s09-replay-capacity/ownership-lease.json",
    "base_sha": "7b933b4c597bc98fd64441f4c90f3120f3d685ea",
    "head_sha": "6812927c9e110a0f203def11806e852c845ce95a",
    "contract_sha256": "13bdac3a60227826550771635d7367854a8a5477240ed06b2c31198dbd6f5c50",
    "write_set": ["src/research_bridge/ledger.py", "stages/s09-replay-capacity/stage-envelope.json", "stages/s09-replay-capacity/ownership-lease.json"],
    "audit_results": {
      "contract_gate": "green", "privacy_secret_scan": "green", "source_mutation": false,
      "focused_tests": 52, "full_core_tests": 541, "stage0b_tests": 25,
      "replay_side_effects": 0, "rebuilt_equals_stored_projection_hashes": "green",
      "global_sequence_gap_denial": "green", "descriptor_and_storage_tamper_denial": "green",
      "restart_WAIT_AUTHORITY": "green", "single_writer_count": 1,
      "capacity_projection_entry_limit": 256, "capacity_parked_gap_limit": 16,
      "wall_clock_rate_claimed": false, "distributed_scale_or_second_writer": false
    },
    "remote_ci_ref": "https://github.com/KirPonomarev/dual-contour-research-os/actions/runs/29650340771",
    "integration_commit_sha": "23e147f17bc536d181802d068893dc89ca9ad44e"
  },
  "integrity": {"payload_sha256": "4d1f5e8a9fdd5b529cf892f76de66df3eb5b3163acb36c17ffcf31479c145487", "parent_refs": [
    "git:6812927c9e110a0f203def11806e852c845ce95a", "git:23e147f17bc536d181802d068893dc89ca9ad44e",
    "ci:29650340771", "reuse:2c4cc00621273b8f35e68a9bd6e468e61ab9d30eb7b4de6304599df1e6d758c3"
  ]}
}
