{
  "schema_id": "IntegrationReceipt", "schema_version": "1.0.0", "object_id": "integration-s28-e2-aggregate-gate-20260718", "issued_at": "2026-07-18T23:10:00Z",
  "issuer": {"id": "agent-0", "authority_class": "integration-authority"}, "contour": "governance", "classification": "D1_INTERNAL_SANITIZED",
  "payload": {
    "stage_id": "s28-e2-aggregate-gate", "agent_id": "agent-0", "ownership_lease_ref": "stages/s28-e2-aggregate-gate/ownership-lease.json",
    "base_sha": "b9fa2944c35f7edc1474c2e42c91680f1d177e19", "head_sha": "2ec7aeac182c863179762ad32119d635d47469ed", "contract_sha256": "13bdac3a60227826550771635d7367854a8a5477240ed06b2c31198dbd6f5c50",
    "write_set": ["tools/capability_proof.py", "tools/e2_aggregate_gate.py", "docs/receipts/capability/e2-autonomous-research-shadow.json", "docs/receipts/reuse/s28-e2-aggregate-gate.json", "stages/s28-e2-aggregate-gate/stage-envelope.json", "stages/s28-e2-aggregate-gate/ownership-lease.json"],
    "audit_results": {"contract_gate": "green", "privacy_secret_scan": "green", "source_mutation": false, "bridge_runtime_source_mutation": false, "agent0_assurance_tool_mutation": true, "aggregate_status": "AUTONOMOUS_RESEARCH_E2_SHADOW_PASS_FOR_FROZEN_SCOPE", "agenda_status": "AUTONOMOUS_RESEARCH_AGENDA_SHADOW_PASS", "portfolio_status": "AUTONOMOUS_PORTFOLIO_SELECTION_SHADOW_PASS", "falsification_status": "AUTONOMOUS_FALSIFICATION_SHADOW_PASS", "replication_status": "AUTONOMOUS_REPLICATION_SHADOW_PASS", "memory_status": "MEASUREMENT_SCOPED_POPULATION_UPLIFT_NOT_ESTABLISHED", "replication_independence": "PER_PAIR_FROZEN_SCOPE_NOT_GLOBAL", "domain_application": "SHADOW_UNAPPLIED", "autonomous_canonical_mutation": false, "human_required_for_promotion": true, "deployment": false, "live_trading": false, "live_security_execution": false, "grants_authority": false, "model_calls_private_data_or_external_actions": 0},
    "remote_ci_ref": "https://github.com/KirPonomarev/dual-contour-research-os/actions/runs/29664711419", "integration_commit_sha": "5695d6cc9d5006a9a392fa5d62c337e8a2486978"
  },
  "integrity": {"payload_sha256": "1b091a93272f2ce13931e74d5d5ffd4c27368ebdf9e2889d297a5e1a428f1ac4", "parent_refs": ["git:2ec7aeac182c863179762ad32119d635d47469ed", "git:5695d6cc9d5006a9a392fa5d62c337e8a2486978", "ci:29664711419", "capability:capability-proof:b1ca90f8f7f196ddad03fdf3c23150dc2ec6020df27f3791fcfc1fb1d807caf3", "reuse:reuse-s28-e2-aggregate-gate-20260718"]}
}
