{
  "schema_id": "IntegrationReceipt", "schema_version": "1.0.0",
  "object_id": "integration-s23-knowledge-fabric-20260718", "issued_at": "2026-07-18T21:29:00Z",
  "issuer": {"id": "agent-0", "authority_class": "integration-authority"},
  "contour": "governance", "classification": "D1_INTERNAL_SANITIZED",
  "payload": {
    "stage_id": "s23-knowledge-fabric", "agent_id": "agent-1",
    "ownership_lease_ref": "stages/s23-knowledge-fabric/ownership-lease.json",
    "base_sha": "8a14529e5086723bde7d35f669dc0470efa9c56b", "head_sha": "ba861a3f7cd504fefda2c2e2058929fcdef46786",
    "contract_sha256": "13bdac3a60227826550771635d7367854a8a5477240ed06b2c31198dbd6f5c50",
    "write_set": ["src/research_bridge/ledger.py", "stages/s23-knowledge-fabric/stage-envelope.json", "stages/s23-knowledge-fabric/ownership-lease.json"],
    "audit_results": {
      "contract_gate": "green", "privacy_secret_scan": "green", "source_mutation": false,
      "bridge_runtime_source_mutation": true, "schema_or_migration_change": false,
      "focused_tests": 22, "new_knowledge_tests": 7, "full_core_tests": 677, "stage0b_tests": 25,
      "typed_provenance": "green", "shadow_taint_inheritance": "green",
      "memory_off_on_measurable": "green", "retrieval_side_effects": 0,
      "conflict_status": "REPLICATION_REQUIRED_CANDIDATE_ONLY",
      "reusable_failure_memory": "green", "root_energy_and_research_debt": "green",
      "scientific_truth_claimed": false, "canonical_or_domain_writer_authority": false,
      "second_store_vector_db_scheduler_or_shared_writer": false,
      "model_network_external_or_live_actions": 0, "grants_authority": false
    },
    "remote_ci_ref": "https://github.com/KirPonomarev/dual-contour-research-os/actions/runs/29661643555",
    "integration_commit_sha": "c0665219a4ee334ee39cd0ff76056acf02e774dc"
  },
  "integrity": {"payload_sha256": "18e47d18b8dcdcd31199aeb64ad37d65663705c3015dafed551c00c6e45fb080", "parent_refs": ["git:ba861a3f7cd504fefda2c2e2058929fcdef46786", "git:c0665219a4ee334ee39cd0ff76056acf02e774dc", "ci:29661643555", "reuse:reuse-s23-knowledge-fabric-20260718"]}
}
