{
  "schema_id": "IntegrationReceipt",
  "schema_version": "1.0.0",
  "object_id": "integration-s2-market-public-dataset-temporal-integrity-20260717",
  "issued_at": "2026-07-17T19:25:00Z",
  "issuer": {
    "id": "agent-0",
    "authority_class": "integration-authority"
  },
  "contour": "market",
  "classification": "D1_INTERNAL_SANITIZED",
  "payload": {
    "stage_id": "s2-market-public-dataset-temporal-integrity",
    "agent_id": "agent-3",
    "ownership_lease_ref": "stages/s2-market-public-dataset-temporal-integrity/ownership-lease.json",
    "base_sha": "e5690e170eb410056e0ffadbc966e45ade3bf714",
    "head_sha": "b9fd2b8af8d3ab9405dd0f432d2a39bbb6e3bb94",
    "contract_sha256": "13bdac3a60227826550771635d7367854a8a5477240ed06b2c31198dbd6f5c50",
    "write_set": [
      "data/bridge_pre_soak/public_ohlcv/binance_spot_btcusdt_1h_2024-01-01_2024-01-02.csv",
      "data/bridge_pre_soak/public_ohlcv/binance_spot_btcusdt_1h_2024-01-01_2024-01-02.manifest.json",
      "src/market_lab/bridge_pre_soak_dataset.py",
      "tests/test_bridge_pre_soak_dataset.py"
    ],
    "audit_results": {
      "contract_gate": "green",
      "public_bridge_sha": "e5690e170eb410056e0ffadbc966e45ade3bf714",
      "public_exact_head_ci": "https://github.com/KirPonomarev/dual-contour-research-os/actions/runs/29605657413",
      "private_base_sha": "96da40a62ef021a6bc5fbe4820e388ee961899a7",
      "private_worker_commit_sha": "b9fd2b8af8d3ab9405dd0f432d2a39bbb6e3bb94",
      "focused_dataset_tests": 9,
      "focused_cross_boundary_tests": 32,
      "reuse_adjacent_tests": 23,
      "private_full_suite_passed": 2951,
      "private_full_suite_initial_failures": 1,
      "private_full_suite_initial_failure": "tests/test_binance_public_aggtrades_zip.py::test_wrong_adjacent_receipt_digest_fails",
      "private_full_suite_initial_failure_unrelated_to_write_set": true,
      "private_full_suite_initial_failure_rerun": "green",
      "private_full_suite_warnings": 68,
      "private_full_suite_seconds": 1044.88,
      "diff_check": "green",
      "private_write_set_exact": true,
      "privacy_secret_scan": "green",
      "privacy_secret_scan_notes": "intentional deny-list literals only; no secret material detected",
      "source_mutation": false,
      "worker_write_set_files": 4,
      "worker_data_files": 2,
      "worker_source_files": 1,
      "worker_test_files": 1,
      "dataset_sha256": "20d4a28d97c5f195df0e421c8449cfcf8825e33940e12fcbd5b7a66650535080",
      "manifest_file_sha256": "81b99d90ecc1d67fe0196123c8bc8e97c3bea380073ef5e0fecd3413cff3c59a",
      "dataset_rows": 24,
      "dataset_provider": "binance_data_vision",
      "dataset_symbol": "BTCUSDT",
      "dataset_timeframe": "1h",
      "first_open_time_utc": "2024-01-01T00:00:00Z",
      "last_open_time_utc": "2024-01-01T23:00:00Z",
      "validation_receipt_outcome": "DATASET_INTEGRITY_PASS",
      "scientific_outcome_applied": false,
      "public_dataset_payload_in_public_repo": false,
      "network_during_validation_or_tests": false,
      "dependency_adoption": false,
      "frozen_contract_edit": false,
      "public_source_mutation": false,
      "private_owner_checkout_mutated": false,
      "declares_market_pre_soak_green": false,
      "live_or_connected_authority": false,
      "private_exact_head_ci": "local-green-with-one-unrelated-flaky-rerun-green-withheld"
    },
    "remote_ci_ref": "https://github.com/KirPonomarev/dual-contour-research-os/actions/runs/29605657413",
    "integration_commit_sha": "e5690e170eb410056e0ffadbc966e45ade3bf714"
  },
  "integrity": {
    "payload_sha256": "3cbe4376094ac8dee30da02aa2a280dd2e2b1dfd8ee57624beb3301135479938",
    "parent_refs": [
      "git:b9fd2b8af8d3ab9405dd0f432d2a39bbb6e3bb94",
      "git:e5690e170eb410056e0ffadbc966e45ade3bf714",
      "ci:29605657413",
      "ci:private-local-one-flaky-rerun-green-withheld",
      "integration:integration-s2-market-public-dataset-temporal-integrity-authority-20260717",
      "source-freeze:source-freeze-market-s2-public-dataset-temporal-integrity-20260717",
      "reuse:reuse-s2-market-public-dataset-temporal-integrity-20260717"
    ]
  }
}
