{
  "schema_id": "IntegrationReceipt", "schema_version": "1.0.0",
  "object_id": "integration-s18-provider-hostile-20260718", "issued_at": "2026-07-18T20:02:00Z",
  "issuer": {"id": "agent-0", "authority_class": "integration-authority"},
  "contour": "governance", "classification": "D1_INTERNAL_SANITIZED",
  "payload": {
    "stage_id": "s18-provider-hostile", "agent_id": "agent-0",
    "ownership_lease_ref": "stages/s18-provider-hostile/ownership-lease.json",
    "base_sha": "923fc65aef1c0511474c9f023b11a0878fb00f18", "head_sha": "468715434c9e22d27dea06383ec9b7a7a862417a",
    "contract_sha256": "13bdac3a60227826550771635d7367854a8a5477240ed06b2c31198dbd6f5c50",
    "write_set": ["tools/model_provider_shadow.py", "tests/test_s18_provider_hostile.py", "docs/receipts/reuse/s18-provider-hostile.json", "stages/s18-provider-hostile/stage-envelope.json", "stages/s18-provider-hostile/ownership-lease.json"],
    "audit_results": {
      "contract_gate": "green", "privacy_secret_scan": "green", "source_mutation": false,
      "bridge_runtime_source_mutation": false, "agent0_connected_tool_mutation": true,
      "focused_tests": 24, "new_hostile_tests": 7,
      "full_core_tests": 652, "stage0b_tests": 25,
      "duplicate_and_nonfinite_json": "REJECTED_AFTER_PRIVATE_CAS_COMMIT",
      "malformed_success_and_http_failure": "CONSERVATIVE_UNKNOWN_NO_RETRY",
      "oversize_body_and_hostile_headers": "REJECTED_BEFORE_ENVELOPE",
      "unknown_budget_release": "EXACT_RECONCILIATION_ONLY",
      "binding_semantic_drift": "REJECTED",
      "unevaluated_kimi_public_route": "REJECTED",
      "gpt_bindings": "WAIT_PROVIDER",
      "joint_error_sample_status": "INDEPENDENCE_NOT_ESTABLISHED",
      "s17_local_proof_sha256": "43fafb2b354813d991da84c1a4757f88b5aee335d4861fa44d2998dcf534a399",
      "additional_real_provider_calls": 0,
      "credentials_or_raw_responses_in_git": 0,
      "canonical_domain_authority_deployment_or_live_writes": 0
    },
    "remote_ci_ref": "https://github.com/KirPonomarev/dual-contour-research-os/actions/runs/29658498353", "integration_commit_sha": "94633760196988d678f51babb5547907c0805f94"
  },
  "integrity": {"payload_sha256": "e54269a3b6af4861fc422fe8a9711fe34512825f27119f3b11b3fca28eab32c7", "parent_refs": ["git:468715434c9e22d27dea06383ec9b7a7a862417a", "git:94633760196988d678f51babb5547907c0805f94", "ci:29658498353", "reuse:reuse-s18-provider-hostile-20260718", "local-proof:sha256:43fafb2b354813d991da84c1a4757f88b5aee335d4861fa44d2998dcf534a399"]}
}
