{
  "schema_id": "IntegrationReceipt",
  "schema_version": "1.0.0",
  "object_id": "integration-s1-pause-epoch-fencing-20260717",
  "issued_at": "2026-07-17T09:54:06Z",
  "issuer": {
    "id": "agent-0",
    "authority_class": "integration-authority"
  },
  "contour": "bridge",
  "classification": "D1_INTERNAL_SANITIZED",
  "payload": {
    "stage_id": "s1-pause-epoch-fencing",
    "agent_id": "agent-2",
    "ownership_lease_ref": "stages/s1-pause-epoch-fencing/ownership-lease.json",
    "base_sha": "11960852e53406af173883be2fc5330dd4bf6392",
    "head_sha": "2add2f856c08d598e1363581bdf6bb15d5f9c4a4",
    "contract_sha256": "13bdac3a60227826550771635d7367854a8a5477240ed06b2c31198dbd6f5c50",
    "write_set": [
      "src/research_bridge/ledger.py",
      "tests/test_stage1_pause_epoch_fencing.py"
    ],
    "audit_results": {
      "contract_gate": "green",
      "focused_tests": 3,
      "connected_tests": 35,
      "canonical_tests": 225,
      "stage0b_tests": 25,
      "skipped_tests": 0,
      "diff_check": "green",
      "privacy_secret_scan": "green",
      "source_mutation": false,
      "dependency_adoption": false,
      "frozen_contract_edit": false,
      "implementation_files_changed": 1,
      "schema_table_index_trigger_or_event_type_change": false,
      "second_ledger_or_checkpoint_store": false,
      "pre_pause_attempt_checkpoint_fenced": "green",
      "pre_pause_attempt_completion_fenced": "green",
      "fence_survives_resume_and_reopen": "green",
      "post_resume_new_attempt_progresses": "green",
      "concurrent_pause_checkpoint_committed_order": "green",
      "denied_transition_writes": 0,
      "live_or_connected_authority": false,
      "global_stage1_gate_declared_green": false,
      "exact_head_remote_ci": "https://github.com/KirPonomarev/dual-contour-research-os/actions/runs/29571547724"
    },
    "remote_ci_ref": "https://github.com/KirPonomarev/dual-contour-research-os/actions/runs/29571547724",
    "integration_commit_sha": "f347024f643035b541f60f967c74017c6fde24c0"
  },
  "integrity": {
    "payload_sha256": "567752698bf59738592c39df391d1c321ac77aa0101ce632f6896c9955aca06f",
    "parent_refs": [
      "git:2add2f856c08d598e1363581bdf6bb15d5f9c4a4",
      "git:f347024f643035b541f60f967c74017c6fde24c0",
      "ci:29571547724",
      "reuse:reuse-s1-pause-epoch-fencing-20260717"
    ]
  }
}
