{
  "schema_id": "IntegrationReceipt",
  "schema_version": "1.0.0",
  "object_id": "integration-s33-generated-isolation-20260719",
  "issued_at": "2026-07-19T00:17:07Z",
  "issuer": {"id": "agent-0", "authority_class": "integration-authority"},
  "contour": "governance",
  "classification": "D1_INTERNAL_SANITIZED",
  "payload": {
    "stage_id": "s33-generated-isolation",
    "agent_id": "agent-2",
    "ownership_lease_ref": "stages/s33-generated-isolation/ownership-lease.json",
    "base_sha": "a3650c76cdb1169571bdb08f5ccf06c8354d1dbf",
    "head_sha": "8f1889c87619cb0f25308791e9fbeb8424727591",
    "contract_sha256": "13bdac3a60227826550771635d7367854a8a5477240ed06b2c31198dbd6f5c50",
    "write_set": ["src/research_bridge/generated_execution.py", "stages/s33-generated-isolation/"],
    "audit_results": {
      "contract_gate": "green", "privacy_secret_scan": "green", "source_mutation": false,
      "bridge_runtime_source_mutation": true, "feature_off_default": true,
      "exact_parent_job_permit_lease_inheritance": true, "L1_L2_only": true, "L3_unreachable": true,
      "attested_rootless_backend_plan": true, "plan_and_rollback_digest_bound": true,
      "artifact_CAS_and_fence_validation": true, "resource_and_path_caps": true,
      "rejected_attempt_telemetry_retained": true, "rollback_state": "WAIT_AUTHORITY",
      "executor_subprocess_Docker_API_network_host_IO": 0, "automatic_deploy": false,
      "canonical_writes": 0, "grants_authority": false
    },
    "remote_ci_ref": "https://github.com/KirPonomarev/dual-contour-research-os/actions/runs/29666684893",
    "integration_commit_sha": "2177f6cf9ca0d13915d669e697d5b2a78e12ab51"
  },
  "integrity": {
    "payload_sha256": "825512b9b99f1ec8316caf6a884eb2e2d34343dcd71702b510dea28f9a8c48cc",
    "parent_refs": ["git:8f1889c87619cb0f25308791e9fbeb8424727591", "git:2177f6cf9ca0d13915d669e697d5b2a78e12ab51", "ci:29666684893", "git:a3650c76cdb1169571bdb08f5ccf06c8354d1dbf"]
  }
}
