{
  "schema_id": "IntegrationReceipt",
  "schema_version": "1.0.0",
  "object_id": "integration-s2-market-cost-provider-accounting-authority-20260717",
  "issued_at": "2026-07-17T19:25:00Z",
  "issuer": {
    "id": "agent-0",
    "authority_class": "integration-authority"
  },
  "contour": "market",
  "classification": "D1_INTERNAL_SANITIZED",
  "payload": {
    "stage_id": "s2-market-cost-provider-accounting-authority",
    "agent_id": "agent-0",
    "ownership_lease_ref": "stages/s2-market-cost-provider-accounting-authority/ownership-lease.json",
    "base_sha": "79cdd4c45d5fdf79c9c5024ad50d379452793303",
    "head_sha": "90eaf04f39aa6ffb1835ac726b98b73d112ebf82",
    "contract_sha256": "13bdac3a60227826550771635d7367854a8a5477240ed06b2c31198dbd6f5c50",
    "write_set": [
      "docs/receipts/source-freeze/s2-market-cost-provider-accounting.json",
      "docs/receipts/reuse/s2-market-cost-provider-accounting.json",
      "stages/s2-market-cost-provider-accounting-authority/stage-envelope.json",
      "stages/s2-market-cost-provider-accounting-authority/ownership-lease.json",
      "tests/test_stage2_authority.py"
    ],
    "audit_results": {
      "contract_gate": "green",
      "focused_stage2_authority_tests": 7,
      "canonical_tests": 316,
      "stage0b_tests": 25,
      "skipped_tests": 0,
      "diff_check": "green",
      "privacy_secret_scan": "green",
      "source_mutation": false,
      "public_source_mutation": false,
      "private_source_mutation": false,
      "dependency_adoption": false,
      "frozen_contract_edit": false,
      "selected_private_head_clean": true,
      "selected_private_head": "b9fd2b8af8d3ab9405dd0f432d2a39bbb6e3bb94",
      "authorized_worker_files": 3,
      "public_provider_payload_in_public_repo": false,
      "declares_market_pre_soak_green": false,
      "live_or_connected_authority": false,
      "exact_head_remote_ci": "https://github.com/KirPonomarev/dual-contour-research-os/actions/runs/29607312212"
    },
    "remote_ci_ref": "https://github.com/KirPonomarev/dual-contour-research-os/actions/runs/29607312212",
    "integration_commit_sha": "90eaf04f39aa6ffb1835ac726b98b73d112ebf82"
  },
  "integrity": {
    "payload_sha256": "59e919b2d9a4df047a3a7d826d56ace43dcd328c1cd36f4d6ebbd070e2eb1044",
    "parent_refs": [
      "git:90eaf04f39aa6ffb1835ac726b98b73d112ebf82",
      "git:b9fd2b8af8d3ab9405dd0f432d2a39bbb6e3bb94",
      "ci:29607312212",
      "source-freeze:source-freeze-market-s2-cost-provider-accounting-20260717",
      "reuse:reuse-s2-market-cost-provider-accounting-20260717"
    ]
  }
}
