{
  "schema_id": "IntegrationReceipt",
  "schema_version": "1.0.0",
  "object_id": "integration-s1-market-ci-reality-loop-20260717",
  "issued_at": "2026-07-17T12:15:33Z",
  "issuer": {
    "id": "agent-0",
    "authority_class": "integration-authority"
  },
  "contour": "market",
  "classification": "D1_INTERNAL_SANITIZED",
  "payload": {
    "stage_id": "s1-market-ci-reality-loop",
    "agent_id": "agent-5",
    "ownership_lease_ref": "stages/s1-market-ci-reality-loop/ownership-lease.json",
    "base_sha": "ce91ae309380869ed1d7eea59ddef3980273e162",
    "head_sha": "ddd80d06e5419113ede9fbce65dcb40b0c0bdc42",
    "contract_sha256": "13bdac3a60227826550771635d7367854a8a5477240ed06b2c31198dbd6f5c50",
    "write_set": [
      ".github/workflows/ci.yml"
    ],
    "audit_results": {
      "contract_gate": "green",
      "private_base_sha": "0d188866cbcd8ad86db049fd250d5490bedcc6d5",
      "focused_real_cli_tests": 5,
      "composed_private_tests": 2934,
      "composed_private_skipped_tests": 0,
      "diff_check": "green",
      "privacy_secret_scan": "green",
      "source_mutation": false,
      "exact_one_step_workflow_diff": "green",
      "prerequisite_gate_at_worker_head": "green",
      "full_suite_retained_as_hard_gate": true,
      "validation_weakening": false,
      "runtime_test_dependency_or_fixture_edit": false,
      "private_exact_head_ci": "green",
      "private_exact_head_sha": "c4c697ef3dc8532321349917a65e1afb379e0ae2",
      "private_ci_locator_disclosed": false,
      "followup_portability_repair_required_and_completed": true,
      "dirty_owner_checkout_mutated": false,
      "live_or_connected_authority": false
    },
    "remote_ci_ref": "https://github.com/KirPonomarev/dual-contour-research-os/actions/runs/29579271906",
    "integration_commit_sha": "19ceba5b67e0cc36964fe817206f73a1bc8747ce"
  },
  "integrity": {
    "payload_sha256": "d260916a360c346805c7b99e96cc6477c109c4a0fc639a6006461dad11f21cd4",
    "parent_refs": [
      "git:ddd80d06e5419113ede9fbce65dcb40b0c0bdc42",
      "git:c4c697ef3dc8532321349917a65e1afb379e0ae2",
      "git:19ceba5b67e0cc36964fe817206f73a1bc8747ce",
      "ci:private-exact-head-green-withheld",
      "ci:29579271906",
      "reuse:reuse-s1-market-ci-reality-loop-prerequisite-20260717"
    ]
  }
}
