{
  "schema_id": "IntegrationReceipt",
  "schema_version": "1.0.0",
  "object_id": "integration-s1-control-authority-20260716",
  "issued_at": "2026-07-16T21:03:17Z",
  "issuer": {"id": "agent-0", "authority_class": "integration-authority"},
  "contour": "bridge",
  "classification": "D1_INTERNAL_SANITIZED",
  "payload": {
    "stage_id": "s1-control-authority",
    "agent_id": "agent-0",
    "ownership_lease_ref": "stages/s1-control-authority/ownership-lease.json",
    "base_sha": "57f1ba40b9964b0be147151b72d1a3821493b916",
    "head_sha": "eb4bc4f143bc0173023f087d0442ee72756fd45e",
    "contract_sha256": "13bdac3a60227826550771635d7367854a8a5477240ed06b2c31198dbd6f5c50",
    "write_set": [
      "docs/receipts/reuse/s1-control-ipc-pause.json",
      "stages/s1-control-authority/ownership-lease.json",
      "stages/s1-control-authority/stage-envelope.json",
      "tests/test_stage1_authority.py"
    ],
    "audit_results": {
      "contract_gate": "green",
      "focused_tests": 5,
      "connected_tests": 91,
      "diff_check": "green",
      "privacy_secret_scan": "green",
      "source_mutation": false,
      "dependency_adoption": false,
      "public_network_surface": false,
      "second_ledger_selected": false
    },
    "remote_ci_ref": "https://github.com/KirPonomarev/dual-contour-research-os/actions/runs/29534515698",
    "integration_commit_sha": "eb4bc4f143bc0173023f087d0442ee72756fd45e"
  },
  "integrity": {
    "payload_sha256": "32eb2626f64c542fe0abf570420512fa25980d9cdd3fb58ebcea81fa29cdc207",
    "parent_refs": [
      "git:eb4bc4f143bc0173023f087d0442ee72756fd45e",
      "ci:29534515698"
    ]
  }
}
