{
  "schema_id": "IntegrationReceipt",
  "schema_version": "1.0.0",
  "object_id": "integration-s1-permit-nonce-ledger-20260717",
  "issued_at": "2026-07-17T11:00:49Z",
  "issuer": {
    "id": "agent-0",
    "authority_class": "integration-authority"
  },
  "contour": "bridge",
  "classification": "D1_INTERNAL_SANITIZED",
  "payload": {
    "stage_id": "s1-permit-nonce-ledger",
    "agent_id": "agent-1",
    "ownership_lease_ref": "stages/s1-permit-nonce-ledger/ownership-lease.json",
    "base_sha": "ca955cd0b835622f820114dd1ceb39b1d7e360e8",
    "head_sha": "7fca8eab7fd03b9441bad516132f17ad7ab24099",
    "contract_sha256": "13bdac3a60227826550771635d7367854a8a5477240ed06b2c31198dbd6f5c50",
    "write_set": [
      "src/research_bridge/admission.py",
      "src/research_bridge/kernel.py",
      "src/research_bridge/ledger.py",
      "src/research_bridge/execution.py",
      "tests/test_stage1_admission.py",
      "tests/test_stage1_ledger.py",
      "tests/test_stage1_assurance.py",
      "tests/test_stage1_execution.py",
      "tests/test_stage1_execution_assurance.py",
      "tests/test_stage1_control_assurance.py",
      "tests/test_stage1_pause_epoch_fencing.py"
    ],
    "audit_results": {
      "contract_gate": "green",
      "targeted_tests": 72,
      "stage1_tests": 203,
      "canonical_tests": 233,
      "stage0b_tests": 25,
      "skipped_tests": 0,
      "diff_check": "green",
      "privacy_secret_scan": "green",
      "source_mutation": false,
      "dependency_adoption": false,
      "frozen_contract_edit": false,
      "table_column_or_event_type_change": false,
      "partial_unique_expression_indexes_added": 1,
      "sequential_duplicate_winners": 1,
      "eight_way_concurrent_winners": 1,
      "eight_way_concurrent_rejections": 7,
      "reopen_duplicate_writes": 0,
      "legacy_or_malformed_duplicate_writes": 0,
      "different_nonce_reference_path": "green",
      "raw_nonce_persisted": false,
      "execution_digest_binding_before_downstream_mutation": "green",
      "global_stage1_gate_declared_green": false,
      "exact_head_remote_ci": "https://github.com/KirPonomarev/dual-contour-research-os/actions/runs/29575363152"
    },
    "remote_ci_ref": "https://github.com/KirPonomarev/dual-contour-research-os/actions/runs/29575363152",
    "integration_commit_sha": "0ccb5c4606dcedc087c0c991d0c0bf27742e510e"
  },
  "integrity": {
    "payload_sha256": "2d39043ad3f4f8f7f73d398bdeaed60328d7962a1e923c43f3f05b2f1ce3c072",
    "parent_refs": [
      "git:7fca8eab7fd03b9441bad516132f17ad7ab24099",
      "git:0ccb5c4606dcedc087c0c991d0c0bf27742e510e",
      "ci:29575363152",
      "reuse:reuse-s1-permit-nonce-ledger-20260717"
    ]
  }
}
